{
  "id": "estacion-02304",
  "codigo": "02304",
  "nombre": "Héroes - Colmena Seguros",
  "ubicacion": "CL 80",
  "troncal": "Autonorte",
  "tipo": "portal",
  "coordenadas": {
    "latitud": 4.66813633,
    "longitud": -74.06031244
  },
  "servicios": {
    "biciparqueadero": false,
    "capacidad_biciparqueadero": 0,
    "wifi": false,
    "accesos": 1
  },
  "fuente": "TransMilenio S.A. - datosabiertos.bogota.gov.co",
  "ultima_actualizacion": "2026-10-09T01:17:55.414Z"
}