{
  "id": "estacion-03006",
  "codigo": "03006",
  "nombre": "Niza - Calle 127",
  "ubicacion": "Av Suba CL 127",
  "troncal": "Suba",
  "tipo": "portal",
  "coordenadas": {
    "latitud": 4.71193004,
    "longitud": -74.07228152
  },
  "servicios": {
    "biciparqueadero": false,
    "capacidad_biciparqueadero": 0,
    "wifi": false,
    "accesos": 2
  },
  "fuente": "TransMilenio S.A. - datosabiertos.bogota.gov.co",
  "ultima_actualizacion": "2026-10-09T01:17:55.414Z"
}