{
  "id": "estacion-12007",
  "codigo": "12007",
  "nombre": "Zona Industrial",
  "ubicacion": "CL 13 KR 38",
  "troncal": "Americas",
  "tipo": "portal",
  "coordenadas": {
    "latitud": 4.62032239,
    "longitud": -74.09868859
  },
  "servicios": {
    "biciparqueadero": false,
    "capacidad_biciparqueadero": 0,
    "wifi": false,
    "accesos": 2
  },
  "fuente": "TransMilenio S.A. - datosabiertos.bogota.gov.co",
  "ultima_actualizacion": "2026-10-09T01:17:55.414Z"
}