{
  "id": "estacion-09107",
  "codigo": "09107",
  "nombre": "Hortúa",
  "ubicacion": "CL 1 Sur - CL 3 Sur",
  "troncal": "Caracas",
  "tipo": "portal",
  "coordenadas": {
    "latitud": 4.59084028,
    "longitud": -74.09023752
  },
  "servicios": {
    "biciparqueadero": false,
    "capacidad_biciparqueadero": 0,
    "wifi": false,
    "accesos": 2
  },
  "fuente": "TransMilenio S.A. - datosabiertos.bogota.gov.co",
  "ultima_actualizacion": "2026-10-09T01:17:55.414Z"
}