{
  "id": "estacion-04108",
  "codigo": "04108",
  "nombre": "Polo – FINCOMERCIO",
  "ubicacion": "Transversal 27",
  "troncal": "Calle 80",
  "tipo": "portal",
  "coordenadas": {
    "latitud": 4.67069263,
    "longitud": -74.06474882
  },
  "servicios": {
    "biciparqueadero": false,
    "capacidad_biciparqueadero": 0,
    "wifi": false,
    "accesos": 1
  },
  "fuente": "TransMilenio S.A. - datosabiertos.bogota.gov.co",
  "ultima_actualizacion": "2026-10-09T01:17:55.414Z"
}