{
  "id": "estacion-03010",
  "codigo": "03010",
  "nombre": "Puentelargo",
  "ubicacion": "Av Suba Tv 48",
  "troncal": "Suba",
  "tipo": "portal",
  "coordenadas": {
    "latitud": 4.69329094,
    "longitud": -74.06714144
  },
  "servicios": {
    "biciparqueadero": false,
    "capacidad_biciparqueadero": 0,
    "wifi": false,
    "accesos": 1
  },
  "fuente": "TransMilenio S.A. - datosabiertos.bogota.gov.co",
  "ultima_actualizacion": "2026-10-09T01:17:55.414Z"
}