{
  "id": "estacion-07108",
  "codigo": "07108",
  "nombre": "AV. El Dorado",
  "ubicacion": "Kr 30 Av 28",
  "troncal": "NQS",
  "tipo": "portal",
  "coordenadas": {
    "latitud": 4.63066292,
    "longitud": -74.07986613
  },
  "servicios": {
    "biciparqueadero": false,
    "capacidad_biciparqueadero": 0,
    "wifi": false,
    "accesos": 1
  },
  "fuente": "TransMilenio S.A. - datosabiertos.bogota.gov.co",
  "ultima_actualizacion": "2026-10-09T01:17:55.414Z"
}