{
  "id": "estacion-07111",
  "codigo": "07111",
  "nombre": "Ricaurte - NQS",
  "ubicacion": "Kr 30 Cl 10",
  "troncal": "NQS",
  "tipo": "cabecera",
  "coordenadas": {
    "latitud": 4.6116862,
    "longitud": -74.09386888
  },
  "servicios": {
    "biciparqueadero": false,
    "capacidad_biciparqueadero": 165,
    "wifi": false,
    "accesos": 2
  },
  "fuente": "TransMilenio S.A. - datosabiertos.bogota.gov.co",
  "ultima_actualizacion": "2026-10-09T01:17:55.414Z"
}