{
  "id": "estacion-10009",
  "codigo": "10009",
  "nombre": "Museo Nacional",
  "ubicacion": "Kra 7- CL 32",
  "troncal": "Cr 7-10",
  "tipo": "portal",
  "coordenadas": {
    "latitud": 4.61524712,
    "longitud": -74.06922646
  },
  "servicios": {
    "biciparqueadero": false,
    "capacidad_biciparqueadero": 0,
    "wifi": false,
    "accesos": 1
  },
  "fuente": "TransMilenio S.A. - datosabiertos.bogota.gov.co",
  "ultima_actualizacion": "2026-10-09T01:17:55.414Z"
}