{
  "id": "estacion-07505",
  "codigo": "07505",
  "nombre": "León XIII",
  "ubicacion": "Autopista Sur - CL 48",
  "troncal": "Soacha",
  "tipo": "portal",
  "coordenadas": {
    "latitud": 4.59217919,
    "longitud": -74.19313846
  },
  "servicios": {
    "biciparqueadero": false,
    "capacidad_biciparqueadero": 0,
    "wifi": false,
    "accesos": 1
  },
  "fuente": "TransMilenio S.A. - datosabiertos.bogota.gov.co",
  "ultima_actualizacion": "2026-10-09T01:17:55.414Z"
}