{
  "id": "estacion-02000",
  "codigo": "02000",
  "nombre": "Portal Norte – Unicervantes",
  "ubicacion": "CL 173",
  "troncal": "Autonorte",
  "tipo": "sencilla",
  "coordenadas": {
    "latitud": 4.75462117,
    "longitud": -74.04603495
  },
  "servicios": {
    "biciparqueadero": false,
    "capacidad_biciparqueadero": 0,
    "wifi": false,
    "accesos": 1
  },
  "fuente": "TransMilenio S.A. - datosabiertos.bogota.gov.co",
  "ultima_actualizacion": "2026-10-09T01:17:55.414Z"
}