{
  "id": "estacion-03004",
  "codigo": "03004",
  "nombre": "Gratamira",
  "ubicacion": "Av Suba Cl 135",
  "troncal": "Suba",
  "tipo": "portal",
  "coordenadas": {
    "latitud": 4.72733705,
    "longitud": -74.07472646
  },
  "servicios": {
    "biciparqueadero": false,
    "capacidad_biciparqueadero": 0,
    "wifi": false,
    "accesos": 1
  },
  "fuente": "TransMilenio S.A. - datosabiertos.bogota.gov.co",
  "ultima_actualizacion": "2026-10-09T01:17:55.414Z"
}