{
  "id": "estacion-05103",
  "codigo": "05103",
  "nombre": "Marsella",
  "ubicacion": "Av. Americas -KR 69C",
  "troncal": "Americas",
  "tipo": "portal",
  "coordenadas": {
    "latitud": 4.62968561,
    "longitud": -74.13016292
  },
  "servicios": {
    "biciparqueadero": false,
    "capacidad_biciparqueadero": 32,
    "wifi": false,
    "accesos": 1
  },
  "fuente": "TransMilenio S.A. - datosabiertos.bogota.gov.co",
  "ultima_actualizacion": "2026-10-09T01:17:55.414Z"
}