{
  "id": "estacion-10005",
  "codigo": "10005",
  "nombre": "Bicentenario",
  "ubicacion": "Kra 10 -CL 5",
  "troncal": "Cr 7-10",
  "tipo": "intermedia",
  "coordenadas": {
    "latitud": 4.59402109,
    "longitud": -74.08183585
  },
  "servicios": {
    "biciparqueadero": false,
    "capacidad_biciparqueadero": 116,
    "wifi": false,
    "accesos": 2
  },
  "fuente": "TransMilenio S.A. - datosabiertos.bogota.gov.co",
  "ultima_actualizacion": "2026-10-09T01:17:55.414Z"
}