{
  "id": "estacion-07104",
  "codigo": "07104",
  "nombre": "7 de Agosto",
  "ubicacion": "Kr 30 CL 63",
  "troncal": "NQS",
  "tipo": "portal",
  "coordenadas": {
    "latitud": 4.65729068,
    "longitud": -74.07766289
  },
  "servicios": {
    "biciparqueadero": false,
    "capacidad_biciparqueadero": 0,
    "wifi": false,
    "accesos": 1
  },
  "fuente": "TransMilenio S.A. - datosabiertos.bogota.gov.co",
  "ultima_actualizacion": "2026-10-09T01:17:55.414Z"
}