{
  "id": "estacion-09103",
  "codigo": "09103",
  "nombre": "Olaya",
  "ubicacion": "CL 24 Sur - CL 27 Su",
  "troncal": "Caracas",
  "tipo": "portal",
  "coordenadas": {
    "latitud": 4.57890853,
    "longitud": -74.10736095
  },
  "servicios": {
    "biciparqueadero": false,
    "capacidad_biciparqueadero": 0,
    "wifi": false,
    "accesos": 1
  },
  "fuente": "TransMilenio S.A. - datosabiertos.bogota.gov.co",
  "ultima_actualizacion": "2026-10-09T01:17:55.414Z"
}